[{
    "id": 0,
    "name": "United States of America",
    "alpha2code": "US",
    "alpha3code": "USA",
    "capital": "Washington, D.C.",
    "flags": {"svg":"https://flagcdn.com/us.svg", "png":"https://flagcdn.com/w320/us.png"},
    "currencies": [{"code":"USD", "name":"United States dollar", "symbol":"$"}],
    "languages": ["English"],
    "subregion": "Northern America",
    "region": "Americas",
    "population": 329484123,
    "latlng": [38.0,-97.0],
    "demonym": "American",
    "regional_blocs": [{"acronym":"NAFTA", "name":"North American Free Trade Agreement"}],
    "independent": true,
    "summary": "The United States of America, commonly known as the United States or America, is a transcontinental country located primarily in North America. It consists of 50 states, a federal district, five major unincorporated territories, nine minor outlying islands, and 326 Indian reservations. It is either the fourth- or third-largest country by land or total area, respectively. The United States shares land borders with Canada to its north and with Mexico to its south. It has maritime borders with the Bahamas, Cuba, Russia, and other nations. With a population of over 331 million, it is the third most populous country in the world. The national capital is Washington, D.C., and the most populous city and financial center is New York City."
},
{
    "id": 1,
    "name": "Italy",
    "alpha2code": "IT",
    "alpha3code": "ITA",
    "capital": "Rome",
    "flags": {"svg":"https://flagcdn.com/it.svg", "png":"https://flagcdn.com/w320/it.png"},
    "currencies": [{"code":"EUR","name":"Euro","symbol":"€"}],
    "languages": ["Italian"],
    "subregion": "Southern Europe",
    "region": "Europe",
    "population": 59554023,
    "latlng": [42.83333333,12.83333333],
    "demonym": "Italian",
    "regional_blocs": [{"acronym":"EU", "name":"European Union"}],
    "independent": true,
    "summary": "Italy, officially the Italian Republic or the Republic of Italy, is a country that consists of a peninsula delimited by the Alps and several islands surrounding it; its territory largely coincides with the homonymous geographical region. Italy is located in the middle of the Mediterranean Sea, in Southern Europe; it is also considered part of Western Europe. A unitary parliamentary republic with Rome as its capital and largest city, the country covers a total area of 301,230 km2 (116,310 sq mi) and shares land borders with France, Switzerland, Austria, Slovenia and the enclaved microstates of Vatican City and San Marino. Italy has a territorial exclave in Switzerland, Campione. With over 60 million inhabitants, Italy is the third-most populous member state of the European Union."
},
{
    "id": 2,
    "name": "Japan",
    "alpha2code": "JP",
    "alpha3code": "JPN",
    "capital": "Tokyo",
    "flags": {"svg":"https://flagcdn.com/jp.svg", "png":"https://flagcdn.com/w320/jp.png"},
    "currencies": [{"code":"JPY", "name":"Japanese yen", "symbol":"¥"}],
    "languages": ["Japanese"],
    "subregion": "Eastern Asia",
    "region": "Asia",
    "population": 125836021,
    "latlng": [36.0,138.0],
    "demonym": "Japanese",
    "independent": true,
    "summary": "Japan is an island country in East Asia. It is situated in the northwest Pacific Ocean, and is bordered on the west by the Sea of Japan, while extending from the Sea of Okhotsk in the north toward the East China Sea, Philippine Sea, and Taiwan in the south. Japan is a part of the Ring of Fire, and spans an archipelago of 6852 islands covering 377,975 square kilometers (145,937 sq mi); the five main islands are Hokkaido, Honshu, Shikoku, Kyushu, and Okinawa. Tokyo is the nation's capital and largest city, followed by Yokohama, Osaka, Nagoya, Sapporo, Fukuoka, Kobe, and Kyoto."
}]